title	link	displayLink	snippet	cacheId	formattedUrl	pagemap
When will a COVID-19 vaccine be ready? | Live Science	https://www.livescience.com/coronavirus-covid-19-vaccine-timeline.html	www.livescience.com	"Apr 16, 2020 ... Anthony Fauci, director of the National Institute of Allergy and Infectious Diseases
, recently said that a COVID-19 could take 12 to 18 months to ..."	HBvwxUjBj7IJ	https://www.livescience.com/coronavirus-covid-19-vaccine-timeline.html	{'cse_thumbnail': [{'src': 'https://encrypted-tbn0.gstatic.com/images?q=tbn:ANd9GcTNNGXkIOdzvLbw_cSjnme-4V1VRAxHuneTrDadAo8YEg41ZNbTLUdYfFpp', 'width': '300', 'height': '168'}], 'imageobject': [{'width': '370', 'url': 'https://cdn.mos.cms.futurecdn.net/MdnsdzKXZTBKnGzMN4BREN.jpg', 'height': '602'}], 'metatags': [{'og:image': 'https://cdn.mos.cms.futurecdn.net/MdnsdzKXZTBKnGzMN4BREN-1200-80.jpg', 'og:image:width': '1200', 'twitter:card': 'summary_large_image', 'og:site_name': 'livescience.com', 'taboola:url': 'https://www.livescience.com/coronavirus-covid-19-vaccine-timeline.html', 'parsely-author': 'Nicoletta Lanese', 'msapplication-tileimage': 'https://vanilla.futurecdn.net/livescience/181546/apple-touch-icon.png', 'twitter:creator': '@LiveScience', 'article:publisher': 'https://www.facebook.com/livescience?cmpid=556687', 'twitter:image': 'https://cdn.mos.cms.futurecdn.net/MdnsdzKXZTBKnGzMN4BREN-1200-80.jpg', 'pub_date': '2020-04-16T20:28:48+00:00', 'parsely-type': 'post', 'twitter:site': '@LiveScience', 'parsely-link': 'https://www.livescience.com/coronavirus-covid-19-vaccine-timeline.html', 'parsely-image-url': 'https://cdn.mos.cms.futurecdn.net/MdnsdzKXZTBKnGzMN4BREN.jpg', 'parsely-section': 'Coronavirus', 'botify-site-verification': 'Bvex9ErUud910tVAIquqUVU7RH2if7uS', 'twitter:account_id': '9696142', 'msapplication-tilecolor': '#000000', 'og:type': 'article', 'twitter:title': 'When will a COVID-19 vaccine be ready?', 'parsely-post-id': 'tLdjRWqZLgE59rWM2Tv9hA', 'og:title': 'When will a COVID-19 vaccine be ready?', 'parsely-title': 'When will a COVID-19 vaccine be ready?', 'article:author': 'https://www.facebook.com/livescience?cmpid=556687', 'parsely-pub-date': '2020-04-16T20:28:48Z', 'parsely-tags': 'Category: Coronavirus,Category: Other,Category: News,health,coronavirus vaccine,coronavirus transmission,coronavirus infection,covid-19,covid-19 vaccine,vaccine,vaccine trials,vaccine safety,vaccine effectiveness,vaccine development,sars-2-cov,coronavirus updates,channel_other,type_news,syndicate,serversidehawk', 'viewport': 'width=device-width,minimum-scale=1,initial-scale=1', 'og:url': 'https://www.livescience.com/coronavirus-covid-19-vaccine-timeline.html'}], 'cse_image': [{'src': 'https://cdn.mos.cms.futurecdn.net/MdnsdzKXZTBKnGzMN4BREN-1200-80.jpg'}]}
What are the Top 5 most promising COVID-19 vaccine candidates ...	https://allianceforscience.cornell.edu/blog/2020/05/what-are-the-top-5-most-promising-covid-19-vaccine-candidates/	allianceforscience.cornell.edu	"2 days ago ... These engineered adenoviruses, when put into a vaccine, trigger an immune 
response in the human body, protecting against COVID-19. This is a ..."	qGkfBDFjjMkJ	https://allianceforscience.cornell.edu/.../what-are-the-top-5-most-promising- covid-19-vaccine-candidates/	{'cse_thumbnail': [{'src': 'https://encrypted-tbn3.gstatic.com/images?q=tbn:ANd9GcTigosipgq35JvRJzSX-QLOgeB8P_Ef_SHb1N52ZJWL4SIytmwoqWdYq8Gl', 'width': '259', 'height': '194'}], 'metatags': [{'og:image': 'https://allianceforscience.cornell.edu/wp-content/uploads/2020/05/shutterstock_1109126054.jpg', 'og:type': 'article', 'article:section': 'vaccines', 'og:image:width': '1515', 'twitter:card': 'summary_large_image', 'twitter:title': 'What are the Top 5 most promising COVID-19 vaccine candidates? - Alliance for Science', 'og:site_name': 'Alliance for Science', 'og:title': 'What are the Top 5 most promising COVID-19 vaccine candidates? - Alliance for Science', 'og:image:height': '1136', 'msapplication-tileimage': '/wp-content/uploads/2018/03/cropped-AfS-favicon-270x270.png', 'og:description': 'We’ve compiled a list of the top 5 most promising candidate vaccine platforms, with a brief summary of relevant details. We’ll keep this page updated so come back regularly to learn the latest developments.', 'og:image:secure_url': 'https://allianceforscience.cornell.edu/wp-content/uploads/2020/05/shutterstock_1109126054.jpg', 'twitter:image': 'https://allianceforscience.cornell.edu/wp-content/uploads/2020/05/shutterstock_1109126054.jpg', 'viewport': 'width=device-width, initial-scale=1.0', 'twitter:description': 'We’ve compiled a list of the top 5 most promising candidate vaccine platforms, with a brief summary of relevant details. We’ll keep this page updated so come back regularly to learn the latest developments.', 'og:locale': 'en_US', 'og:url': 'https://allianceforscience.cornell.edu/blog/2020/05/what-are-the-top-5-most-promising-covid-19-vaccine-candidates/'}], 'cse_image': [{'src': 'https://allianceforscience.cornell.edu/wp-content/uploads/2020/05/shutterstock_1109126054.jpg'}]}
COVID-19 Vaccine Frontrunners | The Scientist Magazine®	https://www.the-scientist.com/news-opinion/covid-19-vaccine-frontrunners-67382	www.the-scientist.com	"Apr 7, 2020 ... COVID-19 Vaccine Frontrunners. Several vaccine candidates have been 
approved for early testing in people. Many more are close on their ..."	pXKIgnwP-JIJ	https://www.the-scientist.com/news.../covid-19-vaccine-frontrunners-67382	{'cse_thumbnail': [{'src': 'https://encrypted-tbn1.gstatic.com/images?q=tbn:ANd9GcRk4II0-fWTTSPVc8ERO9TXJT6IwteBJD0cERxipSYL5QcgQR4SauhTI4g', 'width': '268', 'height': '188'}], 'metatags': [{'og:image': 'https://cdn.the-scientist.com/assets/articleNo/67382/aImg/37035/vaccine-m.jpg', 'twitter:card': 'summary_large_image', 'twitter:title': 'COVID-19 Vaccine Frontrunners', 'og:site_name': 'The Scientist Magazine®', 'viewport': 'width=device-width, initial-scale=1, minimum-scale=1, shrink-to-fit=no', 'twitter:description': 'Several vaccine candidates have been approved for early testing in people. Many more are close on their heels.', 'og:title': 'COVID-19 Vaccine Frontrunners', 'og:description': 'Several vaccine candidates have been approved for early testing in people. Many more are close on their heels.', 'twitter:image': 'https://cdn.the-scientist.com/assets/articleNo/67382/aImg/37035/vaccine-l.jpg'}], 'cse_image': [{'src': 'https://cdn.the-scientist.com/assets/articleNo/67382/aImg/37035/vaccine-m.jpg'}]}
Trump Administration's Operation Warp Speed Accelerates ...	https://www.hhs.gov/about/news/2020/05/21/trump-administration-accelerates-astrazeneca-covid-19-vaccine-to-be-available-beginning-in-october.html	www.hhs.gov	"May 21, 2020 ... ... at least 300 million doses of a coronavirus vaccine called AZD1222, ... 
Operation Warp Speed Accelerates AstraZeneca COVID-19 Vaccine ..."	6dcZPSxHpGgJ	https://www.hhs.gov/.../trump-administration-accelerates-astrazeneca-covid- 19-vaccine-to-be-available-beginning-in-october.html	{'cse_thumbnail': [{'src': 'https://encrypted-tbn2.gstatic.com/images?q=tbn:ANd9GcS-x0W743kiymHgmpTHAbK3izjLitYcgXIM5z7NTishyhgmPYV4DNz9xVg', 'width': '180', 'height': '180'}], 'NewsArticle': [{'articleBody': 'Responding to President Trump’s call to develop 300 million doses of SARS-CoV-2 vaccine by January under Operation Warp Speed, the U.S. Department of Health and Human Services (HHS) and AstraZene...', 'name': 'Trump Administration’s Operation Warp Speed Accelerates AstraZeneca COVID-19 Vaccine to be Available Beginning in October'}], 'metatags': [{'og:image': 'https://www.hhs.gov/sites/default/files/HHS-Twitter-Card-180x180.jpg', 'og:image:width': '180', 'twitter:card': 'summary', 'article:published_time': '2020-05-21T00:22:05-04:00', 'og:site_name': 'HHS.gov', 'dcterms.language': 'en', 'twitter:url': 'https://www.hhs.gov/about/news/2020/05/21/trump-administration-accelerates-astrazeneca-covid-19-vaccine-to-be-available-beginning-in-october.html', 'dcterms.title': 'Trump Administration’s Operation Warp Speed Accelerates AstraZeneca COVID-19 Vaccine to be Available Beginning in October', 'twitter:image:height': '143', 'og:image:type': 'image/jpeg', 'og:description': 'Responding to President Trump’s call to develop 300 million doses of SARS-CoV-2 vaccine by January under Operation Warp Speed, the U.S. Department of Health and Human Services (HHS) and AstraZeneca are collaborating to make available at least 300 million doses of a coronavirus vaccine called AZD1222, with the first doses delivered as early as October 2020.', 'twitter:creator': '@hhsgov', 'twitter:image': 'https://www.hhs.gov/sites/default/files/news-release-thumbnail.jpg', 'twitter:site': '@HHSgov', 'twitter:image:width': '143', 'article:modified_time': '2020-05-21 2:27:41', 'dcterms.modified': '2020-05-21T02:27-04:00', 'og:type': 'article', 'twitter:title': 'Trump Administration’s Operation Warp Speed Accelerates AstraZeneca', 'twitter:site:id': '44783853', 'dcterms.type': 'Text', 'og:title': 'Trump Administration’s Operation Warp Speed Accelerates AstraZeneca COVID-19 Vaccine to be Available Beginning in October', 'og:image:height': '180', 'dcterms.creator': 'News Division', 'dcterms.date': '2020-05-21T00:22-04:00', 'og:updated_time': '2020-05-21T02:27:41-04:00', 'twitter:creator:id': '44783853', 'viewport': 'width=device-width, initial-scale=1.0', 'twitter:description': 'Responding to President Trump’s call to develop 300 million doses of SARS-CoV-2 vaccine by January under Operation Warp Speed, the U.S. Department of Health and Human Services (HHS) and AstraZeneca', 'dcterms.format': 'text/html', 'dcterms.audience': 'Media/Journalists, Health Professionals', 'og:url': 'https://www.hhs.gov/about/news/2020/05/21/trump-administration-accelerates-astrazeneca-covid-19-vaccine-to-be-available-beginning-in-october.html', 'dcterms.identifier': 'https://www.hhs.gov/about/news/2020/05/21/trump-administration-accelerates-astrazeneca-covid-19-vaccine-to-be-available-beginning-in-october.html'}], 'cse_image': [{'src': 'https://www.hhs.gov/sites/default/files/HHS-Twitter-Card-180x180.jpg'}]}
When Will Covid-19 Vaccine Be Ready and Become Widely ...	https://www.youtube.com/watch?v=L85No8y2D70	www.youtube.com	"2 days ago ... ... Jerome Kim, director general of the International Vaccine Institute, looks at the 
efforts around the globe to develop vaccines for Covid-19."	Wo8h2CB4qTwJ	https://www.youtube.com/watch?v=L85No8y2D70	{'cse_thumbnail': [{'src': 'https://encrypted-tbn2.gstatic.com/images?q=tbn:ANd9GcQ9rzD7x11sB-JQCwzWrqvOjxKl1r1TiChR7ZJ7xJkYEJK4ziQj2z7KpCw', 'width': '259', 'height': '194'}], 'imageobject': [{'width': '480', 'url': 'https://i.ytimg.com/vi/L85No8y2D70/hqdefault.jpg', 'height': '360'}], 'person': [{'url': 'http://www.youtube.com/channel/UCIALMKvObZNtJ6AmdCLP7Lg'}], 'metatags': [{'og:image': 'https://i.ytimg.com/vi/L85No8y2D70/hqdefault.jpg', 'twitter:app:url:iphone': 'vnd.youtube://www.youtube.com/watch?v=L85No8y2D70&feature=applinks', 'twitter:app:id:googleplay': 'com.google.android.youtube', 'theme-color': '#ff0000', 'og:image:width': '480', 'twitter:card': 'player', 'og:site_name': 'YouTube', 'twitter:url': 'https://www.youtube.com/watch?v=L85No8y2D70', 'twitter:app:url:ipad': 'vnd.youtube://www.youtube.com/watch?v=L85No8y2D70&feature=applinks', 'al:android:package': 'com.google.android.youtube', 'twitter:app:name:googleplay': 'YouTube', 'title': 'When Will Covid-19 Vaccine Be Ready and Become Widely Available?', 'al:ios:url': 'vnd.youtube://www.youtube.com/watch?v=L85No8y2D70&feature=applinks', 'twitter:app:id:iphone': '544007664', 'og:description': 'May.27 -- Jerome Kim, director general of the International Vaccine Institute, looks at the efforts around the globe to develop vaccines for Covid-19. He spe...', 'al:ios:app_store_id': '544007664', 'twitter:image': 'https://i.ytimg.com/vi/L85No8y2D70/hqdefault.jpg', 'twitter:player': 'https://www.youtube.com/embed/L85No8y2D70', 'twitter:player:height': '720', 'twitter:site': '@youtube', 'og:video:type': 'text/html', 'og:video:height': '720', 'og:video:url': 'https://www.youtube.com/embed/L85No8y2D70', 'og:type': 'video.other', 'twitter:title': 'When Will Covid-19 Vaccine Be Ready and Become Widely Available?', 'al:ios:app_name': 'YouTube', 'og:title': 'When Will Covid-19 Vaccine Be Ready and Become Widely Available?', 'og:image:height': '360', 'twitter:app:id:ipad': '544007664', 'al:web:url': 'https://www.youtube.com/watch?v=L85No8y2D70&feature=applinks', 'og:video:secure_url': 'https://www.youtube.com/embed/L85No8y2D70', 'og:video:tag': 'Bloomberg', 'og:video:width': '1280', 'al:android:url': 'vnd.youtube://www.youtube.com/watch?v=L85No8y2D70&feature=applinks', 'fb:app_id': '87741124305', 'twitter:app:url:googleplay': 'https://www.youtube.com/watch?v=L85No8y2D70', 'twitter:app:name:ipad': 'YouTube', 'twitter:description': 'May.27 -- Jerome Kim, director general of the International Vaccine Institute, looks at the efforts around the globe to develop vaccines for Covid-19. He spe...', 'og:url': 'https://www.youtube.com/watch?v=L85No8y2D70', 'twitter:player:width': '1280', 'al:android:app_name': 'YouTube', 'twitter:app:name:iphone': 'YouTube'}], 'videoobject': [{'embedurl': 'https://www.youtube.com/embed/L85No8y2D70', 'playertype': 'HTML5 Flash', 'isfamilyfriendly': 'True', 'uploaddate': '2020-05-26', 'description': 'May.27 -- Jerome Kim, director general of the International Vaccine Institute, looks at the efforts around the globe to develop vaccines for Covid-19. He spe...', 'videoid': 'L85No8y2D70', 'url': 'https://www.youtube.com/watch?v=L85No8y2D70', 'duration': 'PT6M50S', 'unlisted': 'False', 'name': 'When Will Covid-19 Vaccine Be Ready and Become Widely Available?', 'paid': 'False', 'width': '1280', 'regionsallowed': 'AD,AE,AF,AG,AI,AL,AM,AO,AQ,AR,AS,AT,AU,AW,AX,AZ,BA,BB,BD,BE,BF,BG,BH,BI,BJ,BL,BM,BN,BO,BQ,BR,BS,BT,BV,BW,BY,BZ,CA,CC,CD,CF,CG,CH,CI,CK,CL,CM,CN,CO,CR,CU,CV,CW,CX,CY,CZ,DE,DJ,DK,DM,DO,DZ,EC,EE,EG,EH...', 'genre': 'News & Politics', 'interactioncount': '4826', 'channelid': 'UCIALMKvObZNtJ6AmdCLP7Lg', 'datepublished': '2020-05-26', 'thumbnailurl': 'https://i.ytimg.com/vi/L85No8y2D70/hqdefault.jpg', 'height': '720'}], 'cse_image': [{'src': 'https://i.ytimg.com/vi/L85No8y2D70/hqdefault.jpg'}]}
Over 40% of Republicans wrongly believe Bill Gates will use COVID ...	https://www.cnet.com/news/over-40-of-republicans-wrongly-believe-bill-gates-will-use-covid-19-vaccines-to-implant-microchips-in-them/	www.cnet.com	"1 day ago ... A conspiracy theory that Gates is planning to use a future COVID-19 vaccine to 
implant microchips in billions of people in order to monitor their ..."	2eh9w45cSSsJ	https://www.cnet.com/.../over-40-of-republicans-wrongly-believe-bill-gates- will-use-covid-19-vaccines-to-implant-microchips-in-them/	{'cse_thumbnail': [{'src': 'https://encrypted-tbn3.gstatic.com/images?q=tbn:ANd9GcQOzuQOQeErFhu1Zqw2ydYbeHTa4bOipxM7a7kkUMLbB-X92UFCMjlOKu9L', 'width': '259', 'height': '194'}], 'metatags': [{'p:domain_verify': '47524839a64b83c951afca9ef6c838e0', 'og:image': 'https://cnet3.cbsistatic.com/img/6_7EITyNy4BcTknj4dJ0X8kaGTA=/756x567/2020/01/23/8de8d545-df92-4d06-b206-0219d29908b5/bill-gates-favorite-tweets.jpg', 'theme-color': '#B80000', 'msapplication-square70x70logo': 'https://cnet2.cbsistatic.com/fly/bundles/cnetcss/images/core/icon/mstile-70.png', 'twitter:card': 'summary_large_image', 'og:site_name': 'CNET', 'twitter:url': 'https://www.cnet.com/news/over-40-of-republicans-wrongly-believe-bill-gates-will-use-covid-19-vaccines-to-implant-microchips-in-them/', 'msapplication-tooltip': 'Product reviews and prices, software downloads, and tech news - CNET', 'msapplication-wide310x150logo': 'https://cnet4.cbsistatic.com/fly/bundles/cnetcss/images/core/icon/mstile-310x150.png', 'msapplication-tileimage': 'https://cnet4.cbsistatic.com/fly/bundles/cnetcss/images/core/icon/mstile-144.png', 'og:description': 'A survey finds a false conspiracy theory about vaccines implanting tracking microchips is popular among Fox News viewers, Republicans and Trump voters.', 'twitter:creator': '@iansherr', 'article:publisher': 'https://www.facebook.com/cnet', 'twitter:image': 'https://cnet3.cbsistatic.com/img/6_7EITyNy4BcTknj4dJ0X8kaGTA=/756x567/2020/01/23/8de8d545-df92-4d06-b206-0219d29908b5/bill-gates-favorite-tweets.jpg', 'twitter:site': '@CNET', 'msapplication-square310x310logo': 'https://cnet3.cbsistatic.com/fly/bundles/cnetcss/images/core/icon/mstile-310.png', 'news_keywords': 'microsoft, fox news, bill gates, gates, yahoo!', 'fb:admins': '100001036810388', 'article:content_tier': 'free', 'twitter:account_id': '30261067', 'msapplication-tilecolor': '#ffffff', 'msapplication-starturl': 'https://www.cnet.com/', 'og:type': 'article', 'twitter:title': 'Over 40% of Republicans wrongly believe Bill Gates will use COVID-19 vaccines to implant microchips in them', 'msapplication-window': 'width=1024;height=768', 'handheldfriendly': 'True', 'author': 'Ian Sherr', 'og:title': 'Over 40% of Republicans wrongly believe Bill Gates will use COVID-19 vaccines to implant microchips in them', 'msapplication-square150x150logo': 'https://cnet4.cbsistatic.com/fly/bundles/cnetcss/images/core/icon/mstile-150.png', 'fb:pages': '7155422274', 'msapplication-navbutton-color': '#424244', 'article:author': 'https://www.facebook.com/iansherr', 'fb:app_id': '16995676698', 'apple-mobile-web-app-status-bar-style': '#aa1801', 'viewport': 'width=device-width, initial-scale=1, maximum-scale=1, user-scalable=no', 'twitter:description': 'A survey finds a false conspiracy theory about vaccines implanting tracking microchips is popular among Fox News viewers, Republicans and Trump voters.', 'apple-mobile-web-app-capable': 'yes', 'mobileoptimized': '320', 'og:url': 'https://www.cnet.com/news/over-40-of-republicans-wrongly-believe-bill-gates-will-use-covid-19-vaccines-to-implant-microchips-in-them/', 'msapplication-task': 'name=Home; action-uri=https://www.cnet.com/; icon-uri=https://www.cnet.com/favicon.ico', 'format-detection': 'telephone=no', 'article:opinion': 'false'}], 'cse_image': [{'src': 'https://cnet3.cbsistatic.com/img/6_7EITyNy4BcTknj4dJ0X8kaGTA=/756x567/2020/01/23/8de8d545-df92-4d06-b206-0219d29908b5/bill-gates-favorite-tweets.jpg'}]}
COVID-19: Vaccine may be ready by fall and other reasons for hope	https://www.medicalnewstoday.com/articles/covid-19-vaccine-may-be-ready-by-fall-and-other-reasons-for-hope	www.medicalnewstoday.com	"Apr 17, 2020 ... We continue with this Special Feature that focuses on an incoming vaccine and 
other potential treatments for this new coronavirus and the ..."	8ebvUN9TbiwJ	https://www.medicalnewstoday.com/.../covid-19-vaccine-may-be-ready-by- fall-and-other-reasons-for-hope	{'cse_thumbnail': [{'src': 'https://encrypted-tbn1.gstatic.com/images?q=tbn:ANd9GcTQQ55V9aQKpfEKiZ0Xs42SUBm7PFyCJAA8dozaSsdueBlX4YD0vq-w5Y0', 'width': '311', 'height': '162'}], 'metatags': [{'og:image': 'https://post.medicalnewstoday.com/wp-content/uploads/sites/3/2020/04/iStock-1211333698-1200x628.jpg', 'og:type': 'article', 'twitter:title': 'COVID-19: Vaccine may be ready by fall and other reasons for hope', 'twitter:card': 'summary_large_image', 'sailthru.tags': 'cat_public-health,cat_respiratory,cat_flu-sars,cat_immune-system,k1_otherviralinfections,k2_infectious', 'k1': 'otherviralinfections', 'k2': 'infectious', 'og:title': 'COVID-19: Vaccine may be ready by fall and other reasons for hope', 'sailthru.image.thumb': 'https://post.medicalnewstoday.com/wp-content/uploads/sites/3/2020/04/iStock-1211333698-732x549.jpg', 'og:description': 'A SARS-CoV-2 vaccine may be available by the fall, an Ebola drug shows further promise, and an app could help create intelligent physical distancing.', 'twitter:image': 'https://post.medicalnewstoday.com/wp-content/uploads/sites/3/2020/04/iStock-1211333698-732x549.jpg', 'viewport': 'width=device-width, initial-scale=1, user-scalable=no', 'twitter:description': 'A SARS-CoV-2 vaccine may be available by the fall, an Ebola drug shows further promise, and an app could help create intelligent physical distancing.', 'og:url': 'https://www.medicalnewstoday.com/articles/covid-19-vaccine-may-be-ready-by-fall-and-other-reasons-for-hope'}], 'cse_image': [{'src': 'https://post.medicalnewstoday.com/wp-content/uploads/sites/3/2020/04/iStock-1211333698-1200x628.jpg'}]}
COVID-19 Vaccine Tracker	https://biorender.com/covid-vaccine-tracker	biorender.com	"COVID-19 is a new infectious disease caused by the coronavirus strain SARS-
CoV-2. Disease manifestations usually occur in the lungs of infected individuals,
 ..."		https://biorender.com/covid-vaccine-tracker	{'cse_thumbnail': [{'src': 'https://encrypted-tbn0.gstatic.com/images?q=tbn:ANd9GcQoXTZ76kG4N_tyr8iMcHckuxNX6nyhqIo2IsfczO0_0JbBGuNXt5ZW1zM', 'width': '300', 'height': '168'}], 'metatags': [{'application-name': 'BioRender', 'image': 'https://public.biorender.com/images/vaccine-social-image.png', 'og:image': 'https://public.biorender.com/images/vaccine-social-image.png', 'twitter:card': 'summary_large_image', 'twitter:title': 'COVID-19 Vaccine Tracker', 'og:image:alt': 'COVID-19 Vaccine and Therapeutics Tracker, updated daily.', 'theme-color': '#fff', 'og:site_name': 'COVID-19 Vaccine Tracker', 'og:title': 'COVID-19 Vaccine Tracker', 'apple-mobile-web-app-title': 'BioRender', 'og:description': 'COVID-19 Vaccine and Therapeutics Tracker, updated daily.', 'twitter:image': 'https://public.biorender.com/images/vaccine-social-image.png', 'twitter:site': '@biorender', 'apple-mobile-web-app-status-bar-style': 'black-translucent', 'viewport': 'width=device-width, initial-scale=1, shrink-to-fit=no', 'twitter:description': 'COVID-19 Vaccine and Therapeutics Tracker, updated daily.', 'apple-mobile-web-app-capable': 'yes', 'og:locale': 'en_US', 'mobile-web-app-capable': 'yes'}], 'cse_image': [{'src': 'https://public.biorender.com/images/vaccine-social-image.png'}]}
A Look at the Most Promising Candidates for a Covid-19 Vaccine	https://www.bloomberg.com/news/articles/2020-05-08/coronavirus-vaccine-most-promising-candidates	www.bloomberg.com	"May 8, 2020 ... An engineer with an experimental Covid-19 vaccine at Sinovac Biotech's facilities 
in Beijing on April 29. Photographer: Nicolas Asfouri/AFP/Getty ..."	C01dVYAJypMJ	https://www.bloomberg.com/.../coronavirus-vaccine-most-promising- candidates	"{'cse_thumbnail': [{'src': 'https://encrypted-tbn1.gstatic.com/images?q=tbn:ANd9GcQJNpChr_KlvZ2ComVHZDKkqWK6AM_gJEdRgfKIArMiHzjrgWxjmPzaPx9d', 'width': '310', 'height': '163'}], 'metatags': [{'og:image': 'https://assets.bwbx.io/images/users/iqjWHBFdfxIU/i4B_YS9qtE30/v0/1200x630.jpg', 'apple-itunes-app': 'app-id=281941097, affiliate-data=ct=smartbanner_mobileweb&pt=8949&utm_source=smart_banner', 'twitter:card': 'summary_large_image', 'og:site_name': 'Bloomberg.com', 'sailthru.tags': ""Coronavirus,Drug Companies,China,JOHNSON & JOHNSON,Government,Germany,Generic 1st 'GC' Future,Military,Wuhan,SANOFI,technology,businessweek,business,prognosis"", 'al:android:package': 'com.bloomberg.android.plus', 'parsely-author': 'Cristin Flanagan', 'og:description': 'Drug companies and university scientists are testing scores of possible inoculations.', 'twitter:image': 'https://assets.bwbx.io/images/users/iqjWHBFdfxIU/i4B_YS9qtE30/v0/1200x630.jpg', 'parsely-type': 'post', 'twitter:site': '@BW', 'parsely-link': 'https://www.bloomberg.com/news/articles/2020-05-08/coronavirus-vaccine-most-promising-candidates', 'iso-8601-publish-date': '2020-05-08T10:00:30.184Z', 'sailthru.title': 'A Look at the Most Promising Candidates for a Covid-19 Vaccine', 'checksum': 'e3415dc2d0bf54d3c89946a87e107c0a', 'parsely-image-url': 'https://assets.bwbx.io/images/users/iqjWHBFdfxIU/i4B_YS9qtE30/v0/1200x630.jpg', 'parsely-section': 'businessweek', 'article:content_tier': 'metered', 'fb:status': 'A list of the most promising candidates for a coronavirus vaccine.', 'sailthru.date': '2020-05-08T10:00:30.184Z', 'og:type': 'article', 'twitter:title': 'A Look at the Most Promising Candidates for a Covid-19 Vaccine', 'parsely-post-id': 'QA0BSUT0AFBG01', 'og:title': 'A Look at the Most Promising Candidates for a Covid-19 Vaccine', 'parsely-title': 'Coronavirus Vaccine Most Promising Candidates', 'parsely-pub-date': '2020-05-08T10:00:30.184Z', 'al:android:url': 'bloomberg://www.bloomberg.com/news/articles/2020-05-08/coronavirus-vaccine-most-promising-candidates?utm_medium=applink&utm_source=facebook', 'referrer': 'unsafe-url', 'parsely-tags': ""Coronavirus,Drug Companies,China,JOHNSON & JOHNSON,Government,Germany,Generic 1st 'GC' Future,Military,Wuhan,SANOFI,Secondary Brand: technology,Secondary Brand: businessweek,Secondary Brand: business,Franchise: prognosis,Region: Global,Page: article"", 'sailthru.description': 'Drug companies and university scientists are testing scores of possible inoculations.', 'apple-mobile-web-app-status-bar-style': 'black', 'viewport': 'width=device-width, initial-scale=1, viewport-fit=cover', 'twitter:description': 'Drug companies and university scientists are testing scores of possible inoculations.', 'apple-mobile-web-app-capable': 'no', 'og:url': 'https://www.bloomberg.com/news/articles/2020-05-08/coronavirus-vaccine-most-promising-candidates', 'validatedat': '2020-05-28T23:10:30.205Z', 'al:android:app_name': 'Bloomberg', 'sailthru.author': 'Cristin Flanagan,Riley Griffin,Robert Langreth,John Lauerman', 'article:opinion': 'false'}], 'cse_image': [{'src': 'https://assets.bwbx.io/images/users/iqjWHBFdfxIU/i4B_YS9qtE30/v0/1200x630.jpg'}]}"
